{
  "schema_version": "0.1.0",
  "run_id": "RUN-OFS005-PILOT-010",
  "previous_run_id": "RUN-OFS005-PILOT-009",
  "generated_at": "2026-08-23T21:13:44.558265Z",
  "summary": {
    "source_changes": 16,
    "actionable_source_changes": 0,
    "reobservation_gaps": 0,
    "impacted_evidence_bundles": 0,
    "impacted_claim_proposals": 0,
    "impacted_center_profiles": 0,
    "impacted_decisions": 0,
    "promotion_blocked": false
  },
  "impacts": [
    {
      "canonical_url": "https://computeexpresslink.org/wp-content/uploads/2025/11/CXL_4.0-Specification-Release_FINAL_Website-Copy.pdf",
      "observation_query": "HPC AI systems interoperability standard specification memory interconnect storage software standards organization",
      "classification": "unchanged",
      "source_refs": [
        "proposals/sources/RUN-OFS005-PILOT-009/WORK-000015.json",
        "proposals/sources/RUN-OFS005-PILOT-010/WORK-000015.json"
      ],
      "evidence_bundle_refs": [
        "proposals/evidence/RUN-OFS005-PILOT-009/WORK-000031.json",
        "proposals/evidence/RUN-OFS005-PILOT-010/WORK-000031.json"
      ],
      "claim_proposal_refs": [
        "proposals/claims/RUN-OFS005-PILOT-009/WORK-000035.json",
        "proposals/claims/RUN-OFS005-PILOT-010/WORK-000035.json"
      ],
      "center_profile_refs": [],
      "decision_refs": [
        "decisions/RUN-OFS005-PILOT-009/PRP-CLM-287657.json",
        "decisions/RUN-OFS005-PILOT-010/PRP-CLM-152317.json"
      ],
      "action": "none",
      "promotion_blocked": false,
      "reasons": [
        "No dependent artifact requires automatic review from this observation."
      ]
    },
    {
      "canonical_url": "https://green-innovation.nedo.go.jp/article/digital-infrastructure-02/",
      "observation_query": "site:go.jp 高性能計算 半導体 AI アクセラレータ メモリ 光 量子 研究開発",
      "classification": "unchanged",
      "source_refs": [
        "proposals/sources/RUN-OFS005-PILOT-009/WORK-000008.json",
        "proposals/sources/RUN-OFS005-PILOT-010/WORK-000008.json"
      ],
      "evidence_bundle_refs": [
        "proposals/evidence/RUN-OFS005-PILOT-009/WORK-000024.json",
        "proposals/evidence/RUN-OFS005-PILOT-010/WORK-000024.json"
      ],
      "claim_proposal_refs": [
        "proposals/claims/RUN-OFS005-PILOT-009/WORK-000038.json",
        "proposals/claims/RUN-OFS005-PILOT-010/WORK-000038.json"
      ],
      "center_profile_refs": [],
      "decision_refs": [
        "decisions/RUN-OFS005-PILOT-009/PRP-CLM-714270.json",
        "decisions/RUN-OFS005-PILOT-010/PRP-CLM-464299.json"
      ],
      "action": "none",
      "promotion_blocked": false,
      "reasons": [
        "No dependent artifact requires automatic review from this observation."
      ]
    },
    {
      "canonical_url": "https://impact.ornl.gov/en/publications/frontier-exploring-exascale-the-system-architecture-of-the-first--2/",
      "observation_query": "HPC AI for Science system architecture performance energy evaluation peer reviewed conference paper",
      "classification": "unchanged",
      "source_refs": [
        "proposals/sources/RUN-OFS005-PILOT-009/WORK-000014.json",
        "proposals/sources/RUN-OFS005-PILOT-010/WORK-000014.json"
      ],
      "evidence_bundle_refs": [
        "proposals/evidence/RUN-OFS005-PILOT-009/WORK-000030.json",
        "proposals/evidence/RUN-OFS005-PILOT-010/WORK-000030.json"
      ],
      "claim_proposal_refs": [
        "proposals/claims/RUN-OFS005-PILOT-009/WORK-000034.json",
        "proposals/claims/RUN-OFS005-PILOT-010/WORK-000034.json"
      ],
      "center_profile_refs": [],
      "decision_refs": [
        "decisions/RUN-OFS005-PILOT-009/PRP-CLM-340186.json",
        "decisions/RUN-OFS005-PILOT-010/PRP-CLM-965179.json"
      ],
      "action": "none",
      "promotion_blocked": false,
      "reasons": [
        "No dependent artifact requires automatic review from this observation."
      ]
    },
    {
      "canonical_url": "https://pawsey.org.au/technology-refresh/",
      "observation_query": "worldwide HPC AI for Science architecture accelerator memory interconnect storage software roadmap",
      "classification": "unchanged",
      "source_refs": [
        "proposals/sources/RUN-OFS005-PILOT-009/WORK-000002.json",
        "proposals/sources/RUN-OFS005-PILOT-010/WORK-000002.json"
      ],
      "evidence_bundle_refs": [
        "proposals/evidence/RUN-OFS005-PILOT-009/WORK-000018.json",
        "proposals/evidence/RUN-OFS005-PILOT-010/WORK-000018.json"
      ],
      "claim_proposal_refs": [
        "proposals/claims/RUN-OFS005-PILOT-009/WORK-000040.json",
        "proposals/claims/RUN-OFS005-PILOT-010/WORK-000040.json"
      ],
      "center_profile_refs": [],
      "decision_refs": [
        "decisions/RUN-OFS005-PILOT-009/PRP-CLM-902706.json",
        "decisions/RUN-OFS005-PILOT-010/PRP-CLM-406538.json"
      ],
      "action": "none",
      "promotion_blocked": false,
      "reasons": [
        "No dependent artifact requires automatic review from this observation."
      ]
    },
    {
      "canonical_url": "https://projects.preferred.jp/mn-core/en/",
      "observation_query": "Japan HPC technology processor accelerator memory photonics software startup",
      "classification": "unchanged",
      "source_refs": [
        "proposals/sources/RUN-OFS005-PILOT-009/WORK-000012.json",
        "proposals/sources/RUN-OFS005-PILOT-010/WORK-000012.json"
      ],
      "evidence_bundle_refs": [
        "proposals/evidence/RUN-OFS005-PILOT-009/WORK-000028.json",
        "proposals/evidence/RUN-OFS005-PILOT-010/WORK-000028.json"
      ],
      "claim_proposal_refs": [
        "proposals/claims/RUN-OFS005-PILOT-009/WORK-000036.json",
        "proposals/claims/RUN-OFS005-PILOT-010/WORK-000036.json"
      ],
      "center_profile_refs": [],
      "decision_refs": [
        "decisions/RUN-OFS005-PILOT-009/PRP-CLM-239071.json",
        "decisions/RUN-OFS005-PILOT-010/PRP-CLM-139778.json"
      ],
      "action": "none",
      "promotion_blocked": false,
      "reasons": [
        "No dependent artifact requires automatic review from this observation."
      ]
    },
    {
      "canonical_url": "https://sc.ddbj.nig.ac.jp/guides/overview/",
      "observation_query": "site:ac.jp スーパーコンピュータ 技術 コンパイラ ネットワーク ストレージ",
      "classification": "unchanged",
      "source_refs": [
        "proposals/sources/RUN-OFS005-PILOT-009/WORK-000009.json",
        "proposals/sources/RUN-OFS005-PILOT-010/WORK-000009.json"
      ],
      "evidence_bundle_refs": [
        "proposals/evidence/RUN-OFS005-PILOT-009/WORK-000025.json",
        "proposals/evidence/RUN-OFS005-PILOT-010/WORK-000025.json"
      ],
      "claim_proposal_refs": [
        "proposals/claims/RUN-OFS005-PILOT-009/WORK-000037.json",
        "proposals/claims/RUN-OFS005-PILOT-010/WORK-000037.json"
      ],
      "center_profile_refs": [],
      "decision_refs": [
        "decisions/RUN-OFS005-PILOT-009/PRP-CLM-031380.json",
        "decisions/RUN-OFS005-PILOT-010/PRP-CLM-912120.json"
      ],
      "action": "none",
      "promotion_blocked": false,
      "reasons": [
        "No dependent artifact requires automatic review from this observation."
      ]
    },
    {
      "canonical_url": "https://www.cc.u-tokyo.ac.jp/supercomputer/miyabi/system.php",
      "observation_query": "site:ac.jp スーパーコンピュータ 技術 コンパイラ ネットワーク ストレージ",
      "classification": "unchanged",
      "source_refs": [
        "proposals/sources/RUN-OFS005-PILOT-009/WORK-000010.json",
        "proposals/sources/RUN-OFS005-PILOT-010/WORK-000010.json"
      ],
      "evidence_bundle_refs": [
        "proposals/evidence/RUN-OFS005-PILOT-009/WORK-000026.json",
        "proposals/evidence/RUN-OFS005-PILOT-010/WORK-000026.json"
      ],
      "claim_proposal_refs": [
        "proposals/claims/RUN-OFS005-PILOT-009/WORK-000037.json",
        "proposals/claims/RUN-OFS005-PILOT-010/WORK-000037.json"
      ],
      "center_profile_refs": [],
      "decision_refs": [
        "decisions/RUN-OFS005-PILOT-009/PRP-CLM-031380.json",
        "decisions/RUN-OFS005-PILOT-010/PRP-CLM-912120.json"
      ],
      "action": "none",
      "promotion_blocked": false,
      "reasons": [
        "No dependent artifact requires automatic review from this observation."
      ]
    },
    {
      "canonical_url": "https://www.energy.gov/documents/fy-2026-advanced-scientific-computing-research-budget-request",
      "observation_query": "site:gov OR site:edu supercomputing exascale post-exascale AI infrastructure roadmap",
      "classification": "unchanged",
      "source_refs": [
        "proposals/sources/RUN-OFS005-PILOT-009/WORK-000003.json",
        "proposals/sources/RUN-OFS005-PILOT-010/WORK-000003.json"
      ],
      "evidence_bundle_refs": [
        "proposals/evidence/RUN-OFS005-PILOT-009/WORK-000019.json",
        "proposals/evidence/RUN-OFS005-PILOT-010/WORK-000019.json"
      ],
      "claim_proposal_refs": [
        "proposals/claims/RUN-OFS005-PILOT-009/WORK-000039.json",
        "proposals/claims/RUN-OFS005-PILOT-010/WORK-000039.json"
      ],
      "center_profile_refs": [],
      "decision_refs": [
        "decisions/RUN-OFS005-PILOT-009/PRP-CLM-349955.json",
        "decisions/RUN-OFS005-PILOT-010/PRP-CLM-022564.json"
      ],
      "action": "none",
      "promotion_blocked": false,
      "reasons": [
        "No dependent artifact requires automatic review from this observation."
      ]
    },
    {
      "canonical_url": "https://www.eurohpc-ju.europa.eu/document/download/a4c7e874-845b-4ff8-9f78-ec0747d180ec_en?filename=Decision+08.2025+Revised+MASP+%28Amendment+No+3%29.pdf",
      "observation_query": "worldwide HPC AI for Science architecture accelerator memory interconnect storage software roadmap",
      "classification": "unchanged",
      "source_refs": [
        "proposals/sources/RUN-OFS005-PILOT-009/WORK-000001.json",
        "proposals/sources/RUN-OFS005-PILOT-010/WORK-000001.json"
      ],
      "evidence_bundle_refs": [